{
  "schema_version": 1,
  "catalog_version": 1,
  "description": "Canonical, implementation-independent features available to OpenRec rank models.",
  "policies": {
    "entity_profile_v1": {
      "as_of": "Latest entity mutation whose occurred_at is not later than the requested snapshot time.",
      "time": {"basis": "event_time", "unit": "epoch_seconds", "timezone": "UTC"},
      "identity": {"key": "entity id", "mutation_order": "occurred_at then business timestamp"},
      "invalid_input": {"missing_entity_id": "reject", "missing_value": "use feature default"}
    },
    "event_behavior_v1": {
      "as_of": "Only events with event.time less than or equal to the requested snapshot time are visible.",
      "time": {"field": "event.time", "basis": "event_time", "unit": "epoch_seconds", "timezone": "UTC", "window_boundary": "[as_of-window, as_of]"},
      "identity": {"deduplication_key": "event.trace_id", "fallback": "event.id; otherwise user_id,item_id,scene,type,time"},
      "invalid_input": {"missing_user_id": "reject", "missing_item_id": "reject", "invalid_time": "reject", "invalid_numeric_value": 0, "empty_scene": "treat_as_missing"}
    }
  },
  "features": [
    {"id":"user.country","definition_version":1,"entity":"user","group":"profile","name":"country","description":"Country associated with the user at the snapshot time.","value_type":"string","shape":"categorical","source":{"logical_entity":"user","field":"country"},"policy":"entity_profile_v1","default":"","materialization":{"online":true,"offline":true,"backfillable":true},"status":"stable"},
    {"id":"user.city","definition_version":1,"entity":"user","group":"profile","name":"city","description":"City associated with the user at the snapshot time.","value_type":"string","shape":"categorical","source":{"logical_entity":"user","field":"city"},"policy":"entity_profile_v1","default":"","materialization":{"online":true,"offline":true,"backfillable":true},"status":"stable"},
    {"id":"user.gender","definition_version":1,"entity":"user","group":"profile","name":"gender","description":"User gender value supplied by the user profile.","value_type":"boolean","shape":"scalar","source":{"logical_entity":"user","field":"gender"},"policy":"entity_profile_v1","default":false,"materialization":{"online":true,"offline":true,"backfillable":true},"status":"stable"},
    {"id":"user.age","definition_version":1,"entity":"user","group":"profile","name":"age","description":"User age in years at the snapshot time.","value_type":"float64","shape":"scalar","source":{"logical_entity":"user","field":"age","unit":"years"},"policy":"entity_profile_v1","default":0,"materialization":{"online":true,"offline":true,"backfillable":true},"status":"stable"},
    {"id":"user.tags","definition_version":1,"entity":"user","group":"profile","name":"tags","description":"Unordered set of profile tags associated with the user.","value_type":"string","shape":"multi_value","source":{"logical_entity":"user","field":"tags"},"policy":"entity_profile_v1","default":[],"materialization":{"online":true,"offline":true,"backfillable":true},"status":"stable"},

    {"id":"item.category","definition_version":1,"entity":"item","group":"profile","name":"category","description":"Unordered set of categories associated with the item.","value_type":"string","shape":"multi_value","source":{"logical_entity":"item","field":"category"},"policy":"entity_profile_v1","default":[],"materialization":{"online":true,"offline":true,"backfillable":true},"status":"stable"},
    {"id":"item.scene","definition_version":1,"entity":"item","group":"profile","name":"scene","description":"Recommendation scene to which the item belongs.","value_type":"string","shape":"categorical","source":{"logical_entity":"item","field":"scene"},"policy":"entity_profile_v1","default":"","materialization":{"online":true,"offline":true,"backfillable":true},"status":"stable"},
    {"id":"item.weight","definition_version":1,"entity":"item","group":"profile","name":"weight","description":"Business weight assigned to the item profile.","value_type":"float64","shape":"scalar","source":{"logical_entity":"item","field":"weight"},"policy":"entity_profile_v1","default":0,"materialization":{"online":true,"offline":true,"backfillable":true},"status":"stable"},

    {"id":"user.event_count","definition_version":1,"entity":"user","group":"behavior","name":"event_count","description":"Number of valid events observed for the user.","value_type":"float64","shape":"scalar","source":{"logical_entity":"event","group_by":"user_id"},"aggregation":{"operator":"count"},"policy":"event_behavior_v1","default":0,"materialization":{"online":true,"offline":true,"backfillable":true},"status":"stable"},
    {"id":"user.event_value_sum","definition_version":1,"entity":"user","group":"behavior","name":"event_value_sum","description":"Sum of numeric event values observed for the user.","value_type":"float64","shape":"scalar","source":{"logical_entity":"event","field":"value","group_by":"user_id"},"aggregation":{"operator":"sum"},"policy":"event_behavior_v1","default":0,"materialization":{"online":true,"offline":true,"backfillable":true},"status":"stable"},
    {"id":"user.event_value_mean","definition_version":1,"entity":"user","group":"behavior","name":"event_value_mean","description":"Arithmetic mean of numeric event values observed for the user.","value_type":"float64","shape":"scalar","source":{"logical_entity":"event","field":"value","group_by":"user_id"},"aggregation":{"operator":"mean","denominator":"event_count"},"policy":"event_behavior_v1","default":0,"materialization":{"online":true,"offline":true,"backfillable":true},"status":"stable"},
    {"id":"user.event_active_days","definition_version":1,"entity":"user","group":"behavior","name":"event_active_days","description":"Distinct UTC calendar days on which the user produced a valid event.","value_type":"float64","shape":"scalar","source":{"logical_entity":"event","field":"time","group_by":"user_id"},"aggregation":{"operator":"distinct_count","expression":"floor(time / 86400)","exact":true},"policy":"event_behavior_v1","default":0,"materialization":{"online":true,"offline":true,"backfillable":true},"status":"stable"},
    {"id":"user.event_unique_scene_count","definition_version":1,"entity":"user","group":"behavior","name":"event_unique_scene_count","description":"Number of distinct non-empty scenes in valid user events.","value_type":"float64","shape":"scalar","source":{"logical_entity":"event","field":"scene","group_by":"user_id"},"aggregation":{"operator":"distinct_count","exact":true},"policy":"event_behavior_v1","default":0,"materialization":{"online":true,"offline":true,"backfillable":true},"status":"stable"},
    {"id":"user.event_unique_item_count","definition_version":1,"entity":"user","group":"behavior","name":"event_unique_item_count","description":"Number of distinct items in valid user events.","value_type":"float64","shape":"scalar","source":{"logical_entity":"event","field":"item_id","group_by":"user_id"},"aggregation":{"operator":"distinct_count","exact":true},"policy":"event_behavior_v1","default":0,"materialization":{"online":true,"offline":true,"backfillable":true},"status":"stable"},
    {"id":"user.event_first_time","definition_version":1,"entity":"user","group":"behavior","name":"event_first_time","description":"Earliest valid event time observed for the user, in epoch seconds.","value_type":"float64","shape":"scalar","source":{"logical_entity":"event","field":"time","group_by":"user_id"},"aggregation":{"operator":"min"},"policy":"event_behavior_v1","default":0,"materialization":{"online":true,"offline":true,"backfillable":true},"status":"stable"},
    {"id":"user.event_last_time","definition_version":1,"entity":"user","group":"behavior","name":"event_last_time","description":"Latest valid event time visible for the user, in epoch seconds.","value_type":"float64","shape":"scalar","source":{"logical_entity":"event","field":"time","group_by":"user_id"},"aggregation":{"operator":"max"},"policy":"event_behavior_v1","default":0,"materialization":{"online":true,"offline":true,"backfillable":true},"status":"stable"},
    {"id":"user.event_recency_seconds","definition_version":1,"entity":"user","group":"behavior","name":"event_recency_seconds","description":"Non-negative seconds from snapshot time to the user's latest valid event.","value_type":"float64","shape":"scalar","source":{"logical_entity":"event","group_by":"user_id"},"aggregation":{"operator":"derived","expression":"max(0, as_of_time - event_last_time)"},"policy":"event_behavior_v1","default":0,"materialization":{"online":true,"offline":true,"backfillable":true},"status":"stable"},
    {"id":"user.event_count_1d","definition_version":1,"entity":"user","group":"behavior","name":"event_count_1d","description":"Valid user events in the inclusive one-day event-time window.","value_type":"float64","shape":"scalar","source":{"logical_entity":"event","group_by":"user_id"},"aggregation":{"operator":"count","window_seconds":86400},"policy":"event_behavior_v1","default":0,"materialization":{"online":true,"offline":true,"backfillable":true},"status":"stable"},
    {"id":"user.event_count_7d","definition_version":1,"entity":"user","group":"behavior","name":"event_count_7d","description":"Valid user events in the inclusive seven-day event-time window.","value_type":"float64","shape":"scalar","source":{"logical_entity":"event","group_by":"user_id"},"aggregation":{"operator":"count","window_seconds":604800},"policy":"event_behavior_v1","default":0,"materialization":{"online":true,"offline":true,"backfillable":true},"status":"stable"},